{
  "$schema": "https://json-schema.org/draft/2020-12/schema",
  "$id": "https://dgx-forge.invalid/schemas/workload-release-lock.schema.json",
  "title": "DGX-Forge immutable workload release lock",
  "type": "object",
  "additionalProperties": false,
  "required": [
    "schema_version",
    "family_id",
    "upstream_version",
    "upstream_identity",
    "components",
    "dependency_digests",
    "adapter",
    "adapter_abi",
    "compatibility",
    "validation",
    "provenance",
    "resolver"
  ],
  "properties": {
    "schema_version": {"const": 1},
    "family_id": {"$ref": "#/$defs/identifier"},
    "upstream_version": {"type": "string", "minLength": 1, "maxLength": 128},
    "upstream_identity": {"$ref": "#/$defs/upstream_identity"},
    "components": {
      "type": "array",
      "maxItems": 255,
      "items": {"$ref": "#/$defs/component"}
    },
    "dependency_digests": {
      "type": "array",
      "maxItems": 256,
      "uniqueItems": true,
      "items": {"$ref": "#/$defs/sha256"}
    },
    "adapter": {"$ref": "#/$defs/component"},
    "adapter_abi": {"type": "integer", "minimum": 1, "maximum": 255},
    "compatibility": {"$ref": "#/$defs/compatibility"},
    "validation": {
      "type": "array",
      "maxItems": 64,
      "items": {"$ref": "#/$defs/validation"}
    },
    "provenance": {
      "type": "array",
      "maxItems": 64,
      "items": {"$ref": "#/$defs/evidence"}
    },
    "resolver": {"$ref": "#/$defs/resolver"}
  },
  "$defs": {
    "identifier": {
      "type": "string",
      "pattern": "^[a-z0-9](?:[a-z0-9._-]{0,126}[a-z0-9])?$"
    },
    "sha256": {"type": "string", "pattern": "^[0-9a-f]{64}$"},
    "content_digest": {"type": "string", "pattern": "^sha256:[0-9a-f]{64}$"},
    "platform": {
      "type": "string",
      "pattern": "^[a-z0-9][a-z0-9._-]*/[a-z0-9][a-z0-9._-]*$"
    },
    "source": {
      "oneOf": [
        {
          "type": "object",
          "additionalProperties": false,
          "required": ["provider", "url"],
          "properties": {
            "provider": {"const": "https"},
            "url": {"type": "string", "pattern": "^https://[^?#]+$", "maxLength": 2048}
          }
        },
        {
          "type": "object",
          "additionalProperties": false,
          "required": ["provider", "reference"],
          "properties": {
            "provider": {"const": "oci"},
            "reference": {"type": "string", "pattern": "^[a-z0-9][a-z0-9._:/-]{0,510}@sha256:[0-9a-f]{64}$"}
          }
        },
        {
          "type": "object",
          "additionalProperties": false,
          "required": ["provider", "repository", "commit"],
          "properties": {
            "provider": {"const": "git"},
            "repository": {"type": "string", "pattern": "^https://[^?#]+$", "maxLength": 2048},
            "commit": {"type": "string", "pattern": "^(?:[0-9a-f]{40}|[0-9a-f]{64})$"}
          }
        },
        {
          "type": "object",
          "additionalProperties": false,
          "required": ["provider", "repository", "revision"],
          "properties": {
            "provider": {"const": "huggingface"},
            "repository": {"type": "string", "pattern": "^[A-Za-z0-9][A-Za-z0-9._-]{0,95}/[A-Za-z0-9][A-Za-z0-9._-]{0,95}$"},
            "revision": {"type": "string", "pattern": "^(?:[0-9a-f]{40}|[0-9a-f]{64})$"}
          }
        },
        {
          "type": "object",
          "additionalProperties": false,
          "required": ["provider", "url", "digest"],
          "properties": {
            "provider": {"enum": ["python-index", "signed-http-index"]},
            "url": {"type": "string", "pattern": "^https://[^?#]+$", "maxLength": 2048},
            "digest": {"$ref": "#/$defs/content_digest"}
          }
        }
      ]
    },
    "evidence": {
      "type": "object",
      "additionalProperties": false,
      "required": ["kind", "digest"],
      "properties": {
        "kind": {"$ref": "#/$defs/identifier"},
        "digest": {"$ref": "#/$defs/content_digest"}
      }
    },
    "materialization": {
      "type": "object",
      "additionalProperties": false,
      "required": ["method"],
      "properties": {
        "method": {
          "enum": ["file", "snapshot", "archive", "oci-content", "configuration", "native-archive", "wheel", "pylock-environment", "executable"]
        }
      }
    },
    "component": {
      "type": "object",
      "additionalProperties": false,
      "required": ["name", "kind", "media_type", "sources", "digest", "size", "unpacked_size", "platforms", "materialization", "evidence"],
      "properties": {
        "name": {"$ref": "#/$defs/identifier"},
        "kind": {"$ref": "#/$defs/identifier"},
        "media_type": {"type": "string", "pattern": "^[a-z0-9][a-z0-9!#$&^_.+-]*/[a-z0-9][a-z0-9!#$&^_.+-]*$"},
        "sources": {"type": "array", "minItems": 1, "maxItems": 8, "items": {"$ref": "#/$defs/source"}},
        "digest": {"$ref": "#/$defs/content_digest"},
        "size": {"type": "integer", "minimum": 1, "maximum": 9223372036854775807},
        "unpacked_size": {"type": ["integer", "null"], "minimum": 1, "maximum": 9223372036854775807},
        "platforms": {"type": "array", "minItems": 1, "maxItems": 16, "uniqueItems": true, "items": {"$ref": "#/$defs/platform"}},
        "materialization": {"$ref": "#/$defs/materialization"},
        "evidence": {"type": "array", "maxItems": 16, "items": {"$ref": "#/$defs/evidence"}}
      }
    },
    "upstream_identity": {
      "oneOf": [
        {
          "type": "object",
          "additionalProperties": false,
          "required": ["provider", "repository", "commit"],
          "properties": {
            "provider": {"const": "git"},
            "repository": {"type": "string", "pattern": "^https://[^?#]+$", "maxLength": 2048},
            "commit": {"type": "string", "pattern": "^(?:[0-9a-f]{40}|[0-9a-f]{64})$"}
          }
        },
        {
          "type": "object",
          "additionalProperties": false,
          "required": ["provider", "repository", "revision"],
          "properties": {
            "provider": {"const": "huggingface"},
            "repository": {"type": "string", "pattern": "^[A-Za-z0-9][A-Za-z0-9._-]{0,95}/[A-Za-z0-9][A-Za-z0-9._-]{0,95}$"},
            "revision": {"type": "string", "pattern": "^(?:[0-9a-f]{40}|[0-9a-f]{64})$"}
          }
        },
        {
          "type": "object",
          "additionalProperties": false,
          "required": ["provider", "reference"],
          "properties": {
            "provider": {"const": "oci"},
            "reference": {"type": "string", "pattern": "^[a-z0-9][a-z0-9._:/-]{0,510}@sha256:[0-9a-f]{64}$"}
          }
        },
        {
          "type": "object",
          "additionalProperties": false,
          "required": ["provider", "project", "version", "digest"],
          "properties": {
            "provider": {"const": "python-index"},
            "project": {"$ref": "#/$defs/identifier"},
            "version": {"type": "string", "minLength": 1, "maxLength": 128},
            "digest": {"$ref": "#/$defs/content_digest"}
          }
        },
        {
          "type": "object",
          "additionalProperties": false,
          "required": ["provider", "url", "digest"],
          "properties": {
            "provider": {"const": "signed-http-index"},
            "url": {"type": "string", "pattern": "^https://[^?#]+$", "maxLength": 2048},
            "digest": {"$ref": "#/$defs/content_digest"}
          }
        }
      ]
    },
    "compatibility": {
      "type": "object",
      "additionalProperties": false,
      "required": ["architectures", "operating_systems", "required_capabilities", "minimum_storage_bytes"],
      "properties": {
        "architectures": {"type": "array", "minItems": 1, "maxItems": 32, "uniqueItems": true, "items": {"$ref": "#/$defs/identifier"}},
        "operating_systems": {"type": "array", "minItems": 1, "maxItems": 32, "uniqueItems": true, "items": {"$ref": "#/$defs/identifier"}},
        "required_capabilities": {"type": "array", "maxItems": 32, "uniqueItems": true, "items": {"$ref": "#/$defs/identifier"}},
        "minimum_storage_bytes": {"type": "integer", "minimum": 1, "maximum": 9223372036854775807},
        "minimum_driver": {"type": "string", "minLength": 1, "maxLength": 64},
        "minimum_cuda": {"type": "string", "minLength": 1, "maxLength": 64},
        "backends": {"type": "array", "minItems": 1, "maxItems": 32, "uniqueItems": true, "items": {"enum": ["oci", "python-venv", "native"]}}
      }
    },
    "validation": {
      "type": "object",
      "additionalProperties": false,
      "required": ["kind"],
      "properties": {
        "kind": {"$ref": "#/$defs/identifier"},
        "component": {"$ref": "#/$defs/identifier"},
        "digest": {"$ref": "#/$defs/content_digest"},
        "required": {"type": "boolean"}
      }
    },
    "resolver": {
      "type": "object",
      "additionalProperties": false,
      "required": ["name", "version"],
      "properties": {
        "name": {"$ref": "#/$defs/identifier"},
        "version": {"type": "integer", "minimum": 1, "maximum": 2147483647}
      }
    }
  }
}
