{"adapter":{"digest":"sha256:92f5ae51cc5410cae7b19541e433acba4b38a11ec89bca45c91b4da2a9b0575e","evidence":[{"digest":"sha256:92f5ae51cc5410cae7b19541e433acba4b38a11ec89bca45c91b4da2a9b0575e","kind":"provenance"}],"kind":"adapter","materialization":{"method":"executable"},"media_type":"application/vnd.dgx-forge.workload-adapter.v1","name":"mia-deepseek-dual","platforms":["linux/arm64"],"size":1,"sources":[{"commit":"b131b2a22164675890dd1465fd8862b5cfb6ff13","provider":"git","repository":"https://github.com/MiaAI-Lab/DeepSeek-v4-Flash-DSpark-2x-DGX-Spark"}],"unpacked_size":null},"adapter_abi":1,"compatibility":{"architectures":["arm64"],"backends":["oci"],"minimum_storage_bytes":375809638400,"operating_systems":["linux"],"required_capabilities":["package-abi-v1"]},"components":[{"digest":"sha256:82e965c1caa019b31f4d776d0b3eddb0cc0d8e076f189822b8a3bbe3fa115121","evidence":[{"digest":"sha256:82e965c1caa019b31f4d776d0b3eddb0cc0d8e076f189822b8a3bbe3fa115121","kind":"checksum"}],"kind":"model","materialization":{"method":"archive"},"media_type":"application/vnd.dgx-forge.model.v1","name":"model","platforms":["linux/arm64"],"size":1,"sources":[{"provider":"huggingface","repository":"deepseek-ai/DeepSeek-V4-Flash-0731","revision":"9e165c30e2704aec5d9d593cce3eebd58bbef1cb"}],"unpacked_size":null},{"digest":"sha256:a83948492cf13df455170fb42885f5ef4db54fefe0feff0f841ecbff464ac9d8","evidence":[{"digest":"sha256:a83948492cf13df455170fb42885f5ef4db54fefe0feff0f841ecbff464ac9d8","kind":"checksum"}],"kind":"runtime","materialization":{"method":"oci-content"},"media_type":"application/vnd.oci.image.manifest.v1+json","name":"runtime-image","platforms":["linux/arm64"],"size":1,"sources":[{"provider":"oci","reference":"ghcr.io/anemll/dspark-vllm-gx10@sha256:a83948492cf13df455170fb42885f5ef4db54fefe0feff0f841ecbff464ac9d8"}],"unpacked_size":null}],"dependency_digests":[],"family_id":"mia-deepseek","provenance":[{"digest":"sha256:92f5ae51cc5410cae7b19541e433acba4b38a11ec89bca45c91b4da2a9b0575e","kind":"provenance"}],"resolver":{"name":"legacy-projection","version":1},"schema_version":1,"upstream_identity":{"commit":"b131b2a22164675890dd1465fd8862b5cfb6ff13","provider":"git","repository":"https://github.com/MiaAI-Lab/DeepSeek-v4-Flash-DSpark-2x-DGX-Spark"},"upstream_version":"2026.08.legacy-mia","validation":[{"component":"model","kind":"artifact","required":true},{"kind":"health","required":true},{"kind":"inference","required":true}]}
