{"adapter":{"digest":"sha256:ca69bf50d544856357716d4f326dfd88a6c2d1f40f8fb9cfce426f60858482b2","evidence":[{"digest":"sha256:ca69bf50d544856357716d4f326dfd88a6c2d1f40f8fb9cfce426f60858482b2","kind":"provenance"}],"kind":"adapter","materialization":{"method":"executable"},"media_type":"application/vnd.dgx-forge.workload-adapter.v1","name":"ds4-deepseek-single","platforms":["linux/arm64"],"size":1,"sources":[{"commit":"4ad370b4a338efe9723a386673c0e04f6e214108","provider":"git","repository":"https://github.com/Entrpi/ds4"}],"unpacked_size":null},"adapter_abi":1,"compatibility":{"architectures":["arm64"],"backends":["oci"],"minimum_storage_bytes":120000000000,"operating_systems":["linux"],"required_capabilities":["package-abi-v1"]},"components":[{"digest":"sha256:1f6f88d7f968e51e76a118af83f0f7cae7f5df5b915a6cf30db5265228f70c99","evidence":[{"digest":"sha256:1f6f88d7f968e51e76a118af83f0f7cae7f5df5b915a6cf30db5265228f70c99","kind":"checksum"}],"kind":"model","materialization":{"method":"archive"},"media_type":"application/vnd.dgx-forge.model.v1","name":"model","platforms":["linux/arm64"],"size":93691352992,"sources":[{"provider":"huggingface","repository":"antirez/deepseek-v4-gguf","revision":"1cd7b564460821938add0475a60b942c409295e0"}],"unpacked_size":null},{"digest":"sha256:084d9a9ffa47431842c5dec84de97b058034dec0535b2a563bc5db78c9e14615","evidence":[{"digest":"sha256:084d9a9ffa47431842c5dec84de97b058034dec0535b2a563bc5db78c9e14615","kind":"checksum"}],"kind":"runtime","materialization":{"method":"oci-content"},"media_type":"application/vnd.oci.image.manifest.v1+json","name":"runtime-image","platforms":["linux/arm64"],"size":1,"sources":[{"provider":"oci","reference":"ghcr.io/carstvaartjes/spark-ds4@sha256:084d9a9ffa47431842c5dec84de97b058034dec0535b2a563bc5db78c9e14615"}],"unpacked_size":null}],"dependency_digests":[],"family_id":"ds4-deepseek","provenance":[{"digest":"sha256:ca69bf50d544856357716d4f326dfd88a6c2d1f40f8fb9cfce426f60858482b2","kind":"provenance"}],"resolver":{"name":"legacy-projection","version":1},"schema_version":1,"upstream_identity":{"commit":"4ad370b4a338efe9723a386673c0e04f6e214108","provider":"git","repository":"https://github.com/Entrpi/ds4"},"upstream_version":"2026.08.legacy-ds4","validation":[{"component":"model","kind":"artifact","required":true},{"kind":"health","required":true},{"kind":"inference","required":true}]}
